{
  "schema_version": "0.1.0",
  "case_id": "M2M-TEMPLATE-001",
  "title": "Fictional Authoring Template \u2014 replace every template value",
  "maturity": "SYNTHETIC_PUBLIC_REFERENCE",
  "synthetic": true,
  "public_safe": true,
  "decision_charter": {
    "charter_id": "M2M-CHARTER-TEMPLATE-001",
    "decision_statement": "Determine whether the fictional Fictional Template Material pathway has sufficient evidence to enter a bounded next-stage source-validation activity for a fictional precision actuator by 2026-12-15.",
    "mission": "Maintain reliable positioning in a fictional orbital inspection demonstrator.",
    "scope": {
      "included": [
        "Synthetic material identity",
        "Synthetic source evidence",
        "Synthetic bench result",
        "Synthetic alternatives"
      ],
      "excluded": [
        "Supplier identities",
        "Operational mission systems",
        "Certification",
        "Production authorization"
      ]
    },
    "stakeholder_role": "Fictional program materials lead",
    "decision_owner": "Fictional Human Decision Owner",
    "disposition_authority": "Fictional Program Authority",
    "decision_deadline": "2026-12-15",
    "consequence_of_error": "A weakly supported source could enter an unnecessary validation activity.",
    "consequence_of_delay": "The fictional demonstration schedule could lose a planned evaluation window.",
    "requirements": [
      {
        "requirement_id": "REQ-ORIGIN",
        "statement": "Material origin documentation must be traceable to the fictional lot record.",
        "category": "SOURCE",
        "critical": true,
        "method": "Document and chain-of-custody review",
        "evidence_required": [
          "Origin record",
          "Lot record"
        ]
      },
      {
        "requirement_id": "REQ-BENCH",
        "statement": "The fictional bench sample must meet fictional specification FS-17 section 4.2.",
        "category": "MATERIAL",
        "critical": true,
        "method": "Fictional bench method BM-1",
        "evidence_required": [
          "Test record"
        ]
      }
    ],
    "acceptance_criteria": [
      {
        "requirement_id": "AC-ORIGIN",
        "statement": "Origin and lot records are mutually consistent and independently reviewable.",
        "category": "EVIDENCE",
        "critical": true,
        "method": "Independent document review",
        "evidence_required": [
          "Verified origin package"
        ]
      },
      {
        "requirement_id": "AC-BENCH",
        "statement": "Fictional bench result is recorded as PASS under BM-1 with stated limitations.",
        "category": "MATERIAL",
        "critical": true,
        "method": "Result review",
        "evidence_required": [
          "BM-1 test record"
        ]
      }
    ],
    "stop_conditions": [
      "Stop advancement if the origin record remains unknown or contradictory at the decision deadline."
    ],
    "classification": "PUBLIC",
    "allowed_dispositions": [
      "ADVANCE",
      "VALIDATE",
      "PARTNER",
      "HOLD",
      "STOP"
    ],
    "required_reviewers": [
      "Fictional independent technical reviewer"
    ],
    "ai_use": {
      "allowed": [
        "Schema checking",
        "Draft organization"
      ],
      "prohibited": [
        "Autonomous source qualification",
        "Autonomous final disposition"
      ]
    }
  },
  "material_assurance_record": {
    "record_id": "M2M-MAR-TEMPLATE-001",
    "record_version": "0.1.0",
    "mission": {
      "mission_id": "MISSION-001",
      "label": "Fictional orbital inspection demonstration",
      "outcome": "Reliable fictional positioning during a demonstration window."
    },
    "system": {
      "system_id": "SYSTEM-TEMPLATE",
      "label": "Fictional Template System"
    },
    "component": {
      "component_id": "COMPONENT-TEMPLATE",
      "label": "Fictional Template Component",
      "function": "Provide bounded positioning in the synthetic scenario."
    },
    "material": {
      "material_id": "MATERIAL-TEMPLATE",
      "label": "Fictional Template Material",
      "form": "Fictional sintered blank",
      "intended_function": "Support fictional actuator performance."
    },
    "source": {
      "source_id": "SOURCE-TEMPLATE",
      "label": "Fictional Template Source",
      "status": "UNKNOWN"
    },
    "process": {
      "process_id": "PROCESS-TEMPLATE",
      "label": "Fictional Template Process",
      "status": "PARTIALLY_DOCUMENTED"
    },
    "supplier": {
      "supplier_id": "SUPPLIER-TEMPLATE",
      "label": "Fictional Template Supplier",
      "synthetic": true
    },
    "facility": {
      "facility_id": "FACILITY-TEMPLATE",
      "label": "Fictional Template Facility",
      "synthetic": true
    },
    "evidence_records": [
      {
        "evidence_id": "E-001",
        "title": "Fictional Material Specification FS-17",
        "source": "Fictional specification authority",
        "source_type": "STANDARD",
        "locator": "FS-17 section 4.2",
        "version": "1.0",
        "date_issued": "2026-06-01",
        "date_accessed": "2026-08-08",
        "basis": "DOCUMENTED",
        "claim_state": "SUPPORTED",
        "confidence": "HIGH",
        "applicability": "Defines the synthetic bench requirement.",
        "requirement_links": [
          "REQ-BENCH"
        ],
        "claim_links": [
          "CLAIM-BENCH-THRESHOLD"
        ],
        "contradictory_evidence": [],
        "limitations": [
          "Fictional public reference only."
        ],
        "classification": "PUBLIC",
        "ai_involvement": {
          "used": true,
          "tasks": [
            "Draft organization"
          ]
        },
        "human_reviewer": "Fictional Human Reviewer"
      },
      {
        "evidence_id": "E-002",
        "title": "Fictional Supplier Process Statement",
        "source": "Fictional Template Supplier",
        "source_type": "SUPPLIER_RECORD",
        "locator": "Synthetic record PS-4",
        "version": "1.0",
        "date_issued": "2026-06-10",
        "date_accessed": "2026-08-08",
        "basis": "REPORTED",
        "claim_state": "PARTIALLY_SUPPORTED",
        "confidence": "MEDIUM",
        "applicability": "Describes fictional process route P-4.",
        "requirement_links": [
          "REQ-ORIGIN"
        ],
        "claim_links": [
          "CLAIM-PROCESS"
        ],
        "contradictory_evidence": [],
        "limitations": [
          "Supplier-reported and not independently confirmed."
        ],
        "classification": "PUBLIC",
        "ai_involvement": {
          "used": false,
          "tasks": []
        },
        "human_reviewer": "Fictional Human Reviewer"
      },
      {
        "evidence_id": "E-003",
        "title": "Fictional BM-1 Bench Record",
        "source": "Fictional Public Laboratory",
        "source_type": "TEST_RECORD",
        "locator": "BM-1 record 001",
        "version": "1.0",
        "date_issued": "2026-07-01",
        "date_accessed": "2026-08-08",
        "basis": "TESTED",
        "claim_state": "SUPPORTED",
        "confidence": "HIGH",
        "applicability": "Synthetic bench sample under fictional method BM-1.",
        "requirement_links": [
          "REQ-BENCH",
          "AC-BENCH"
        ],
        "claim_links": [
          "CLAIM-BENCH-PASS"
        ],
        "contradictory_evidence": [],
        "limitations": [
          "Single fictional bench sample; no production inference."
        ],
        "classification": "PUBLIC",
        "ai_involvement": {
          "used": false,
          "tasks": []
        },
        "human_reviewer": "Fictional Technical Reviewer"
      },
      {
        "evidence_id": "E-004",
        "title": "Fictional Origin Record",
        "source": "Fictional Template Source",
        "source_type": "SUPPLIER_RECORD",
        "locator": "Origin package placeholder",
        "version": "0.1",
        "date_issued": "2026-07-15",
        "date_accessed": "2026-08-08",
        "basis": "DOCUMENTED",
        "claim_state": "UNKNOWN",
        "confidence": "UNASSESSED",
        "applicability": "Intended to support synthetic source origin.",
        "requirement_links": [
          "REQ-ORIGIN",
          "AC-ORIGIN"
        ],
        "claim_links": [
          "CLAIM-ORIGIN"
        ],
        "contradictory_evidence": [],
        "limitations": [
          "The public synthetic record intentionally omits sufficient origin evidence."
        ],
        "classification": "PUBLIC",
        "ai_involvement": {
          "used": false,
          "tasks": []
        },
        "human_reviewer": "Fictional Human Reviewer"
      },
      {
        "evidence_id": "E-005",
        "title": "Fictional Capacity Statements",
        "source": "Two fictional public statements",
        "source_type": "MANUFACTURER_CLAIM",
        "locator": "Synthetic statements CS-A and CS-B",
        "version": "1.0",
        "date_issued": "2026-07-20",
        "date_accessed": "2026-08-08",
        "basis": "REPORTED",
        "claim_state": "CONTRADICTED",
        "confidence": "LOW",
        "applicability": "Only to the synthetic scenario; not used as production evidence.",
        "requirement_links": [
          "REQ-ORIGIN"
        ],
        "claim_links": [
          "CLAIM-CAPACITY"
        ],
        "contradictory_evidence": [
          "CS-A conflicts with CS-B"
        ],
        "limitations": [
          "No production capacity conclusion is permitted."
        ],
        "classification": "PUBLIC",
        "ai_involvement": {
          "used": true,
          "tasks": [
            "Comparison"
          ]
        },
        "human_reviewer": "Fictional Human Reviewer"
      }
    ],
    "risks": [
      {
        "risk_id": "RISK-001",
        "statement": "Origin evidence is incomplete.",